{
  "$schema": "http://json-schema.org/draft-07/schema#",
  "title": "g_field_stability_v0",
  "type": "object",
  "additionalProperties": false,
  "required": ["version", "created_at", "summary"],
  "properties": {
    "version": {
      "type": "string",
      "const": "g_field_stability_v0"
    },
    "created_at": {
      "type": "string",
      "format": "date-time"
    },
    "source": {
      "type": "string"
    },
    "summary": {
      "type": "object",
      "additionalProperties": false,
      "required": [
        "num_runs",
        "num_points",
        "g_mean_global",
        "g_std_global",
        "max_gate_std",
        "unstable_gates"
      ],
      "properties": {
        "num_runs": { "type": "integer", "minimum": 0 },
        "num_points": { "type": "integer", "minimum": 0 },
        "g_mean_global": { "type": "number" },
        "g_std_global": { "type": "number" },
        "max_gate_std": { "type": "number" },
        "unstable_gates": { "type": "integer", "minimum": 0 }
      }
    },
    "runs": {
      "type": "array",
      "items": {
        "type": "object",
        "additionalProperties": false,
        "required": ["run_id", "created_at", "g_mean", "g_std"],
        "properties": {
          "run_id": { "type": "string" },
          "created_at": { "type": "string", "format": "date-time" },
          "g_mean": { "type": "number" },
          "g_std": { "type": "number" }
        }
      }
    },
    "gates": {
      "type": "array",
      "items": {
        "type": "object",
        "additionalProperties": false,
        "required": ["id", "g_mean", "g_std", "max_delta", "is_unstable"],
        "properties": {
          "id": { "type": "string" },
          "g_mean": { "type": "number" },
          "g_std": { "type": "number" },
          "max_delta": { "type": "number" },
          "is_unstable": { "type": "boolean" }
        }
      }
    }
  }
}
